{
  "$schema": "../schemas/sni-discovery-map.schema.json",
  "policyId": "sni-discovery-map.v1",
  "version": 2,
  "status": "draft-but-authoritative",
  "purpose": "Operatörens handstyrda översättning från SNI 2025-prefix (huvudgrupp / grupp) till en kandidat wizardCategoryId i discovery-taxonomy.v1.json. Version 2 (ADR 0045) täcker alla 87 huvudgrupper så varje SNI-kod resolvar till en kategori; SNI är fortsatt en branschsignal som aldrig väljer scaffold/variant/starter/Dossier direkt. Runtime-konsumtion sker via Discovery Resolver (answers.sniCode) enligt ADR 0045; Backoffice diagnostiserar mappningen read-only.",
  "principles": [
    "SNI 2025 är branschsignal, inte runtime-sanning.",
    "SNI får aldrig välja starterId, scaffoldId, variantId eller Dossier direkt.",
    "Discovery Taxonomy avgör fortsatt scaffold/variant/expectedStarterId/requestedCapabilities efter att resolvern fått en kategori.",
    "Tresiffer-overrides används bara där tvåsiffernivån är för grov (t.ex. SNI 69 splittas i 691 legal och 692 accounting).",
    "Operatören kan trimma en mappning genom att uppdatera denna policy + bumpa version; SNI 2025-källan (sni-2025.v1.json) rörs då inte."
  ],
  "referenceTaxonomy": "data/taxonomies/sni/sni-2025.v1.json",
  "divisionMappings": [
    {
      "sniCode": "01",
      "labelSv": "Jordbruk och jakt samt stödverksamhet i anslutning härtill",
      "wizardCategoryId": "business",
      "confidence": "medium",
      "notesSv": "Lantbruk/jakt — lokal verksamhetspresentation; gårdsbutik kan peka mot ecommerce via wizardens svar."
    },
    {
      "sniCode": "02",
      "labelSv": "Skogsbruk",
      "wizardCategoryId": "business",
      "confidence": "medium"
    },
    {
      "sniCode": "03",
      "labelSv": "Fiske och vattenbruk",
      "wizardCategoryId": "business",
      "confidence": "medium"
    },
    {
      "sniCode": "05",
      "labelSv": "Kolutvinning",
      "wizardCategoryId": "business",
      "confidence": "low"
    },
    {
      "sniCode": "06",
      "labelSv": "Utvinning av råpetroleum och naturgas",
      "wizardCategoryId": "business",
      "confidence": "low"
    },
    {
      "sniCode": "07",
      "labelSv": "Utvinning av metallmalmer",
      "wizardCategoryId": "business",
      "confidence": "low"
    },
    {
      "sniCode": "08",
      "labelSv": "Annan utvinning av mineral",
      "wizardCategoryId": "business",
      "confidence": "low"
    },
    {
      "sniCode": "09",
      "labelSv": "Stödverksamhet avseende utvinning",
      "wizardCategoryId": "business",
      "confidence": "low"
    },
    {
      "sniCode": "10",
      "labelSv": "Livsmedelsframställning",
      "wizardCategoryId": "food",
      "confidence": "medium",
      "notesSv": "Livsmedelsproducent — mat/catering-kategorin täcker producent-presentation; ren webshop avgörs av wizardens svar."
    },
    {
      "sniCode": "11",
      "labelSv": "Framställning av drycker",
      "wizardCategoryId": "food",
      "confidence": "medium"
    },
    {
      "sniCode": "12",
      "labelSv": "Tobaksvarutillverkning",
      "wizardCategoryId": "business",
      "confidence": "low"
    },
    {
      "sniCode": "13",
      "labelSv": "Textilvarutillverkning",
      "wizardCategoryId": "business",
      "confidence": "medium"
    },
    {
      "sniCode": "14",
      "labelSv": "Tillverkning av kläder",
      "wizardCategoryId": "business",
      "confidence": "medium"
    },
    {
      "sniCode": "15",
      "labelSv": "Tillverkning av läder- och skinnvaror och liknande varor av andra material",
      "wizardCategoryId": "business",
      "confidence": "medium"
    },
    {
      "sniCode": "16",
      "labelSv": "Tillverkning av trä och varor av trä och kork, utom möbler: tillverkning av varor av halm, rotting o.d.",
      "wizardCategoryId": "business",
      "confidence": "medium"
    },
    {
      "sniCode": "17",
      "labelSv": "Pappers- och pappersvarutillverkning",
      "wizardCategoryId": "business",
      "confidence": "low"
    },
    {
      "sniCode": "18",
      "labelSv": "Grafisk produktion och reproduktion av inspelningar",
      "wizardCategoryId": "business",
      "confidence": "medium"
    },
    {
      "sniCode": "19",
      "labelSv": "Tillverkning av stenkolsprodukter och raffinerade petroleumprodukter",
      "wizardCategoryId": "business",
      "confidence": "low"
    },
    {
      "sniCode": "20",
      "labelSv": "Tillverkning av kemikalier och kemiska produkter",
      "wizardCategoryId": "business",
      "confidence": "low"
    },
    {
      "sniCode": "21",
      "labelSv": "Tillverkning av farmaceutiska basprodukter och läkemedel",
      "wizardCategoryId": "business",
      "confidence": "low"
    },
    {
      "sniCode": "22",
      "labelSv": "Tillverkning av gummi- och plastvaror",
      "wizardCategoryId": "business",
      "confidence": "low"
    },
    {
      "sniCode": "23",
      "labelSv": "Tillverkning av andra icke-metalliska mineraliska produkter",
      "wizardCategoryId": "business",
      "confidence": "low"
    },
    {
      "sniCode": "24",
      "labelSv": "Stål- och metallframställning",
      "wizardCategoryId": "business",
      "confidence": "low"
    },
    {
      "sniCode": "25",
      "labelSv": "Tillverkning av metallvaror utom maskiner och apparater",
      "wizardCategoryId": "business",
      "confidence": "medium"
    },
    {
      "sniCode": "26",
      "labelSv": "Tillverkning av datorer, elektronikvaror och optik",
      "wizardCategoryId": "tech",
      "confidence": "medium"
    },
    {
      "sniCode": "27",
      "labelSv": "Tillverkning av elapparatur",
      "wizardCategoryId": "business",
      "confidence": "medium"
    },
    {
      "sniCode": "28",
      "labelSv": "Tillverkning av övriga maskiner",
      "wizardCategoryId": "business",
      "confidence": "medium"
    },
    {
      "sniCode": "29",
      "labelSv": "Tillverkning av motorfordon, släpfordon och påhängsvagnar",
      "wizardCategoryId": "business",
      "confidence": "medium",
      "notesSv": "Fordonstillverkning är industri — auto-kategorin är reserverad för handel/verkstad (478/953-overrides)."
    },
    {
      "sniCode": "30",
      "labelSv": "Tillverkning av andra transportmedel",
      "wizardCategoryId": "business",
      "confidence": "low"
    },
    {
      "sniCode": "31",
      "labelSv": "Tillverkning av möbler",
      "wizardCategoryId": "business",
      "confidence": "medium"
    },
    {
      "sniCode": "32",
      "labelSv": "Annan tillverkning",
      "wizardCategoryId": "business",
      "confidence": "medium"
    },
    {
      "sniCode": "33",
      "labelSv": "Reparation, underhåll och installation av maskiner och utrustning",
      "wizardCategoryId": "business",
      "confidence": "medium"
    },
    {
      "sniCode": "35",
      "labelSv": "El-, gas- och ångförsörjning samt luftkonditionering",
      "wizardCategoryId": "business",
      "confidence": "medium"
    },
    {
      "sniCode": "36",
      "labelSv": "Vattenförsörjning",
      "wizardCategoryId": "business",
      "confidence": "low"
    },
    {
      "sniCode": "37",
      "labelSv": "Avloppsrening",
      "wizardCategoryId": "business",
      "confidence": "low"
    },
    {
      "sniCode": "38",
      "labelSv": "Insamling av avfall, återvinning och bortskaffande",
      "wizardCategoryId": "business",
      "confidence": "medium"
    },
    {
      "sniCode": "39",
      "labelSv": "Sanering, efterbehandling av jord och vatten samt annan verksamhet för föroreningsbekämpning",
      "wizardCategoryId": "business",
      "confidence": "medium"
    },
    {
      "sniCode": "41",
      "labelSv": "Byggande av bostadshus och andra byggnader",
      "wizardCategoryId": "construction",
      "confidence": "high"
    },
    {
      "sniCode": "42",
      "labelSv": "Anläggningsarbeten",
      "wizardCategoryId": "construction",
      "confidence": "high"
    },
    {
      "sniCode": "43",
      "labelSv": "Specialiserad bygg- och anläggningsverksamhet",
      "wizardCategoryId": "construction",
      "confidence": "high"
    },
    {
      "sniCode": "46",
      "labelSv": "Parti- och provisionshandel",
      "wizardCategoryId": "business",
      "confidence": "medium",
      "notesSv": "Partihandel är B2B-presentation; webshop-behov avgörs av wizardens svar, inte av SNI."
    },
    {
      "sniCode": "47",
      "labelSv": "Detaljhandel",
      "wizardCategoryId": "ecommerce",
      "confidence": "medium",
      "notesSv": "Detaljhandel kan vara fysisk butik utan webshop; wizardens svar avgör om e-handel faktiskt är aktuell."
    },
    {
      "sniCode": "49",
      "labelSv": "Landtransport; transport i rörsystem",
      "wizardCategoryId": "business",
      "confidence": "medium"
    },
    {
      "sniCode": "50",
      "labelSv": "Sjötransport",
      "wizardCategoryId": "business",
      "confidence": "low"
    },
    {
      "sniCode": "51",
      "labelSv": "Lufttransport",
      "wizardCategoryId": "business",
      "confidence": "low"
    },
    {
      "sniCode": "52",
      "labelSv": "Magasinering, varulagring och stödverksamhet avseende transport",
      "wizardCategoryId": "business",
      "confidence": "medium"
    },
    {
      "sniCode": "53",
      "labelSv": "Post- och kurirverksamhet",
      "wizardCategoryId": "business",
      "confidence": "medium"
    },
    {
      "sniCode": "55",
      "labelSv": "Hotell- och logiverksamhet",
      "wizardCategoryId": "hotel",
      "confidence": "high"
    },
    {
      "sniCode": "56",
      "labelSv": "Restaurang-, catering- och barverksamhet",
      "wizardCategoryId": "restaurant",
      "confidence": "high"
    },
    {
      "sniCode": "58",
      "labelSv": "Förlagsverksamhet",
      "wizardCategoryId": "blog",
      "confidence": "medium",
      "notesSv": "Förlag/utgivning mappar mot blogg/magasin-kategorin."
    },
    {
      "sniCode": "59",